{
  "$schema": "http://json-schema.org/draft-07/schema#",
  "title": "StudyGuide",
  "description": "One-page study guide for a single unit",
  "type": "object",
  "required": ["id", "unit", "subject", "theme", "core_concepts", "exam_tip"],
  "properties": {
    "id": { "type": "string" },
    "unit": { "type": "string" },
    "subject": { "type": "string" },
    "theme": {
      "type": "string",
      "description": "One sentence capturing the unit's core theme"
    },
    "core_concepts": {
      "type": "array",
      "items": {
        "type": "object",
        "required": ["title", "detail"],
        "properties": {
          "title": { "type": "string", "description": "Short (3–6 word) label shown in the accordion header." },
          "detail": { "type": "string", "description": "Full concept explanation. Inline math uses $...$ KaTeX delimiters." }
        },
        "additionalProperties": false
      },
      "minItems": 5,
      "maxItems": 8,
      "description": "Each concept has a short title and a full detail string."
    },
    "formulas": {
      "type": "array",
      "items": {
        "type": "object",
        "required": ["name", "katex_string"],
        "properties": {
          "name": { "type": "string" },
          "katex_string": {
            "type": "string",
            "description": "Valid KaTeX string — rendered in displayMode block. Verified by Checker before integration."
          },
          "description": {
            "type": "string",
            "description": "Plain English: what the formula does and when to use it. No jargon. Required for math subjects (phases 9, 10, 12)."
          },
          "example": {
            "type": "string",
            "description": "Worked example showing the formula in action. Supports $...$ inline KaTeX delimiters. Required for math subjects (phases 9, 10, 12)."
          }
        },
        "additionalProperties": false
      }
    },
    "diagrams": {
      "type": "array",
      "items": {
        "type": "object",
        "required": ["type"],
        "properties": {
          "type": {
            "type": "string",
            "enum": ["table", "chart"]
          },
          "data": {
            "description": "For table: {headers: string[], rows: string[][]}. For chart: Chart.js ChartConfiguration."
          }
        },
        "additionalProperties": false
      }
    },
    "exam_tip": {
      "type": "string",
      "description": "One sentence on what College Board emphasizes from this unit. Inline math uses $...$ KaTeX delimiters."
    }
  },
  "additionalProperties": false
}
